id,document_number,window_number,pair_number,text,label
133.47.184,133,47,184," דא מיטה, שמונה שנים מזכיר מפלגתו ופעמיים ראש ממשלה, הפסיד במרוצת השנתיים האחרונות את שני התפקידים האלה. אם [א1] ינצח [/א1] במשאל-העם על שיטת הבחירות, לא זו בלבד שהשפעתו תגדל וידידיו במפלגה הקומוניסטית [א2] ייהנו [/א2] מהשינוי, אלא שהוא יצליח להחליש במידה ניכרת את יריבו הגדול, קראקסי, מזכיר המפלגה הסוציאליסטית, השלישית בגודלה באיטליה, שהשפעתה היא מעל ומעבר לכוחה בפרלמנט.",BEFORE
54.9.60,54,9,60," הם טענו כי מעמדם [א1] נמצא [/א1] עתה בסכנה, עקב קירבתם ללוי, וכי שר החוץ עצמו אינו נחלץ להגן עליהם. הם אמרו כי בלית ברירה [א2] ינסו [/א2] לגייס תמיכה של חוגים במפלגה נגד הדחות שרון.",BEFORE
56.0.1,56,0,1,"הקהילה היהודית הקובנית בארה""ב [א1] מארגנת [/א1] מסע הזדהות עם מדינת ישראל. מדיווח שהגיע אתמול למשרד התיירות בירושלים עולה, כי במשלחת [א2] המתארגנת [/א2] יקחו חלק כמאה מראשי הקהילה.",EQUAL
124.38.140,124,38,140," בגבול גרמניה-אוסטריה לינדאו-ציגלהאוז התעוררה אסומן, יצאה מהמכונית [א1] שנסעה [/א1] לאיטה בתחבורה העמוסה וקראה לעובדי המכס, ""הצילו אותנו, אבא חוטף אותנו"". האב והדודה [א2] נעצרו [/א2] והבנות עברו שטיפת קיבה.",BEFORE
54.30.164,54,30,164," הוא טען כי יו""ר הסיעה ח""כ שרה דורון הכחישה באוזניו את הטענה כי אי מינויו לוועדת חוץ וביטחון הוא עונש פוליטי. ריבלין [א1] האשים [/א1] ""ח""כים ירושלמים (קרי: הנגבי, קורפו, ויהושע מצא) המנצלים את מעמדם בהנהלת הסיעה, כדי למנוע כל אפשרות [א2] שיכהן [/א2] בחבר בוועדת חוץ וביטחון.",BEFORE
56.1.7,56,1,7," מדיווח שהגיע אתמול למשרד התיירות בירושלים עולה, כי במשלחת [א1] המתארגנת [/א1] יקחו חלק כמאה מראשי הקהילה. הביקור [א2] מתוכנן [/א2] להתקיים בחודש מארס הקרוב, וייתלוו אליו צוותי טלוויזיה ועיתונאים דוברי ספרדית.",EQUAL
48.9.105,48,9,105," הוצאת הכדור בידי רמת גן שנייה לסיום לא שינתה דבר והקבוצות [א1] התייצבו [/א1] להארכה. בהארכה [א2] נראתה [/א2] במגרש קבוצה אחת בלבד, הפועל תל אביב.",BEFORE
29.7.21,29,7,21, אלפי כרטיסים נמכרו וההתעניינות לא נותרה רק באשדוד. שחקני הפועל [א1] הצהירו [/א1] לא אחת כי ההצלחות של עירוני [א2] פגעו [/א2] ביכולתם.,AFTER
22.10.71,22,10,71," הוא אוהב יהודים ומבין בהחלט שהערבים מתעבים את היהודים, [א1] ורואים [/א1] בהם זרים שבאו להשתלט על ארצם ועל אדמתם. ""כיהודי מאמין אני עושה את מה שמצווה עלי התורה ואת מה שדורש ממני אלוהים"", [א2] אמר [/א2] כהנא.",BEFORE
133.18.48,133,18,48," מול הפשע הזה עומד ממשל, שחלק ממנהיגיו נהנה ישירות או בעקיפין מהמצב הזה. גם החוק הפלילי החדש, [א1] שאושר [/א1] אחרי שנות מאבק פוליטי, [א2] מסייע [/א2] בעקיפין לפשע.",BEFORE
8.0.26,8,0,26,"מזכירות איגוד הפועלים החקלאיים הציעה אתמול שהממשלה תשלם מענק חודשי של 500 ש""ח, נוסף לשכר הרגיל, לכל ישראלי שיעבוד בקטיף ההדרים במשך שלושה חודשים לפחות. מזכיר איגוד הפועלים החקלאיים, חיים אביבי, מסר שההצעה [א1] הועלתה [/א1] לנוכח המחסור בעובדי קטיף המורגש כבר כעת [א2] ויוחרף [/א2] בחודש הבא, כשהקטיף יהיה בעיצומו, בעיקר עקב היעדרות עובדים מהשטחים.",BEFORE
124.38.138,124,38,138," בגבול גרמניה-אוסטריה לינדאו-ציגלהאוז התעוררה אסומן, [א1] יצאה [/א1] מהמכונית שנסעה לאיטה בתחבורה העמוסה וקראה לעובדי המכס, ""הצילו אותנו, אבא חוטף אותנו"". האב והדודה [א2] נעצרו [/א2] והבנות עברו שטיפת קיבה.",BEFORE
33.9.20,33,9,20," אולם שיטת הפעולה של נשיא עיראק, אם לא תכניה ויעדה, ראויה בהחלט להשוואה למודל הגרמני. גם היטלר היה [א1] מערבב [/א1] צווחות [א2] מאיימות [/א2] עם דברי נועם, גם הוא לא היה שוכח לרמוז על נכונותו להסדיר בעיות בדרכי שלום, כדי להוליך שולל בני שיח שוטים או מיתממים.",EQUAL
48.5.69,48,5,69," שחקני החיזוק הולקומב ופירסון עשו את המוטל עליהם וקלעו את מיכסת הנקודות שמצפים מהם (ביחד 94 נקודות). האכזבה [א1] באה [/א1] דווקא מבינו, שלא הצליח להתמודד עם גבוהי הפועל, [א2] ומעושה [/א2] המשחק שוורצמן שאיבד כדורים רבים.",AFTER
54.23.124,54,23,124," עד שיזכה ביבי במשרה שתיראה לו הודיעה המפד""ל לשמיר כי נציגה בוועדת הכספים, ח""כ ביבי, לא [א1] יתמוך [/א1] במתן משרת יו""ר הועדה לאגו""י וללא קולו יתקשה הליכוד בהשגת רוב בוועדה להחלפת היו""ר. נוכח המצב, [א2] הציעו [/א2] אתמול בכירים בליכוד להצמיד את סגן השר ביבי אל עמיתו אפרים גור, כך שאם לשניהם אין הרבה סמכויות, אולי יוכלו להסתובב יחד ולחסוך איזה ""וולבו"" ולשכה.",AFTER
26.21.90,26,21,90," [א1] נותר [/א1] רק הקול הנפלא ויכולת הקריאה. במשך שעה תמימה ישוב באחוזתו היפהפייה שתיכנן בעצמו כסדרה של תפאורות במה בנוף פסטורלי ירוק, והמוות מרחף בחלל האוויר הוא [א2] קורא [/א2] משיריהם של מילטון, שייקספיר, אודן, ומהסונטות של אליזבת בראונינג.",BEFORE
124.36.120,124,36,120, אצל מגדת עתידות טורקייה הולעטו הנערות אלכוהול וכדורי שינה [א1] ונלקחו [/א1] לאב. הוא [א2] עמד [/א2] לקחת את בנותיו במכונית לטורקיה כדי להשיא אותן שם.,BEFORE
138.2.27,138,2,27," גורמים המקורבים לתאצר אמרו שהיא רואה בשר החוץ, דאגלס הרד, את יורשה במקרה של ""תקרית אוטובוס"", מונח [א1] שמשתמשים [/א1] בו כדי לציין למי למסור את השלטון אם המנהיג יידרס. הלחץ המחודש להחליפה [א2] התעורר [/א2] בעקבות תבוסה צורבת לשמרנים בבחירות המשנה לפרלמנט בשני מחוזות.",BEFORE
22.10.64,22,10,64," הוא אוהב יהודים ומבין בהחלט שהערבים [א1] מתעבים [/א1] את היהודים, ורואים בהם זרים שבאו להשתלט על ארצם ועל אדמתם. ""כיהודי מאמין אני עושה את מה [א2] שמצווה [/א2] עלי התורה ואת מה שדורש ממני אלוהים"", אמר כהנא.",VAGUE
133.11.17,133,11,17," הפשע המאורגן אינו [א1] נתון [/א1] בידי קבוצה אחת. קבוצות רבות נאבקות ביניהן על השליטה בסחר הסמים והנשק ועל המכרזים הציבוריים הגדולים, [א2] שמזרימים [/א2] לאזור אלפי מיליארדים של לירטות מקופת המדינה ומהשוק המערב אירופי.",AFTER
138.0.0,138,0,0,"לונדון (מיוחד ל""הארץ""). במפלגה השמרנית [א1] מסתמנת [/א1] קבוצה חזקה [א2] המתכוונת [/א2] להעמיד את מייקל הסלטיין כמועמד נגד מארגרט תאצר, בהתמודדות הקרובה על המנהיגות, שנקבעה ל02 בנובמבר.",EQUAL
135.8.26,135,8,26," הופתעתי לקרוא שעל גבי מוצרי לנקום מופיע כתובת היצרן רחוב רויאל 41, פריס. בדקנו מוצרים מספר של חברת לנקום [א1] ומצאנו [/א1] שעל גבי האריזה [א2] מופיע [/א2] בדרך כלל הסימון בלבד, ללא כתובת.",AFTER
124.29.106,124,29,106, כיום [א1] חיה [/א1] הצעירה במעון ומתכוננת לבחינות הבגרות. לעתים קרובות הורים אינם נותנים סיכוי לרשויות הנוער לטפל בילדים [א2] הסובלים [/א2] מהתעללות.,VAGUE
50.6.26,50,6,26," אד הורטון שיחק רק 5 דקות ואולי עם החלפתו [א1] יזוז [/א1] משהו ביד אליהו. מכבי ראשון לציון נאלץ להאבק עד לסיום מול הפועל גבת העמק, אבל הניצחון נשאר בבית 92 98 וראשון [א2] אוחז [/א2] עדיין במקום ה-2.",AFTER
122.12.147,122,12,147," למדתי שזכות היוצרים מחולקת בין האוצר לבין הבנקים: האוצר, באשרו מסגרת כללית לסוג תוכניות מסוים, המציא את השם ""תשורה"" (קודם לכן ""תשואה""), ועתה התיר להוסיף את התיבה ""המשך"" לתוכנית מתוקנת; בנק לאומי המציא את ""כוח"", בנק הפועלים הבריק ב""מטמון"" וכולי. במה מתבטא ה""המשך"", כלומר, מה הם ה""תנאים [א1] הניתנים [/א1] לחוסכים ותיקים בלבד"" בתוכניות ההמשך? בהודעת הבנק [א2] מדובר [/א2] בלשון רבים, אבל למעשה יש רק תנאי משופר אחד: כל המועדים מוקדמים בשנה אחת.",VAGUE
138.1.9,138,1,9," במפלגה השמרנית מסתמנת קבוצה חזקה [א1] המתכוונת [/א1] להעמיד את מייקל הסלטיין כמועמד נגד מארגרט תאצר, בהתמודדות הקרובה על המנהיגות, שנקבעה ל02 בנובמבר. גורמים המקורבים לתאצר אמרו שהיא [א2] רואה [/א2] בשר החוץ, דאגלס הרד, את יורשה במקרה של ""תקרית אוטובוס"", מונח שמשתמשים בו כדי לציין למי למסור את השלטון אם המנהיג יידרס.",VAGUE
138.10.49,138,10,49," בהנהגת המפלגה השמרנית [א1] פרץ [/א1] משבר, עקב התנגדותה של ראש הממשלה להנהגת מטבע אחיד בקהילייה האירופית. על רקע זה [א2] התפטר [/א2] מתפקידו סגן ראש הממשלה סר גפרי האו.",BEFORE
54.22.109,54,22,109," אולם שר התעשיה והמסחר משה נסים, שהיה שותף בצוות המו""ם עם אגו""י והמפלגות הדתיות, אינו מעוניין בסגן שר במשרדו, וגם ארנס אינו [א1] מתלהב [/א1] יותר מדי להצעה כזו. עד שיזכה ביבי במשרה שתיראה לו הודיעה המפד""ל לשמיר כי נציגה בוועדת הכספים, ח""כ ביבי, לא [א2] יתמוך [/א2] במתן משרת יו""ר הועדה לאגו""י וללא קולו יתקשה הליכוד בהשגת רוב בוועדה להחלפת היו""ר.",BEFORE
29.19.36,29,19,36," ביבנה ישחקו היום (1400) מכבי המקומי והפועל טבריה שאינו [א1] מתעלה [/א1] במשחקי חוץ. מכבי רמת עמידר, [א2] שהשיג [/א2] במחזור האחרון ניצחון בכורה, יתמודד בחוץ עם הפועל חדרה.",BEFORE
2.17.90,2,17,90," היא מבוססת על אותו קרב המגננה שבו [א1] אירעו [/א1] מעשי גבורה עילאיים, ועל קבלת החלטות קשות בתנאי קרב. חוסר ניסיון ועלילה זדונית באים לביטוי בקטע המאמר [א2] הדן [/א2] בנושא ""רצח הנזירות"".",BEFORE
31.7.148,31,7,148," בתחום זה לא נעשה דבר: הסכמי העבודה נשארו קשוחים כשהיו, השכר נקבע בשיטות ריכוזיות על בסיס הצמדות וללא כל זיקה למצב בשוק העבודה, והאיגודים המקצועיים [א1] המשיכו [/א1] להפעיל זכויות בלעדיות במשא ומתן עם המעסיקים על מקומות העבודה ותנאיה, תוך התעלמות ממצב המשק. סביר להניח שהממשלה השמרנית החדשה תמשיך במדיניות הליברליזציה; היא [א2] קיבלה [/א2] לשם כך מנדט מהבוחרים.",BEFORE
124.24.86,124,24,86," מלר-המאן, מנהלת מרכז מגע וייעוץ לבני נוער העלולים להתאבד, השתאתה על תגובותיה של אם, שבתה בת ה91 [א1] קפצה [/א1] מהחלון. כעבור זמן מה [א2] סיפרה [/א2] הבת שבגיל תשע תפרה האם את שפתות אבר המין שלה, כיוון שהילדה איחרה לחזור הביתה יום אחד.",BEFORE
22.7.22,22,7,22," מגמה זו נותרה בעינה משך שנים, ולכן גם בראיון אחרון שלו במזרח ירושלים, בעיתון ""א-נהאר"", מובלטת הסיסמה שכהנא [א1] למד [/א1] מגזעני מדינות הדרום בארצות הברית: ""אני אומר את מה שכולם חושבים"". ""א-נהאר"" [א2] חזר [/א2] והדפיס עכשיו, לאחר הרצח, את הראיון המקורי.",BEFORE
128.4.35,128,4,35," בתקופה מסוימת העסיק דיומא צוות שלם של עוזרים בראשותו של ההיסטוריון אוגוסט מיקא. הצוות היה [א1] מכין [/א1] למענו נושאים ושלד של עלילה והוא היה [א2] מוסיף [/א2] את ה""בשר"" בסגנונו הייחודי.",BEFORE
54.42.247,54,42,247," אגף החשב הכללי באוצר [א1] תומך [/א1] בעמדת המשרד לאיכות הסביבה ואילו באגף התקציבים באוצר מצדדים בעמדה ההפוכה. במשרד לאיכות הסביבה [א2] התלוצצו [/א2] השבוע והציעו לתמ""ס להעביר את המרכזייה לבניין החדש, ""ואנו כבר נוכל להסתדר בכוחות עצמנו"".",BEFORE
54.11.66,54,11,66," השר שרון [א1] עומד [/א1] למנות בקרוב את מקורבו, אהרן גרינשטיין, כיו""ר חברת ""לורם"", חברה לפיתוח לוד-רמלה. גרינשטיין, [א2] המכהן [/א2] כסגן ראש עיריית בני ברק, הוא חבר מרכז הליכוד.",AFTER
31.1.11,31,1,11," בשנת 4891 [א1] עלתה [/א1] שם לשלטון מפלגת העבודה וחוללה מהפך בלתי צפוי. במקום להגביר את מעורבות הממשלה במשק, להגדיל את הריכוז ולחזק את הפיקוח על הפעילות הכלכלית, היא הנהיגה ליברליזציה מרחיקת-לכת: [א2] הוחלה [/א2] רפורמה נדיבה במערכת המיסוי, צומצמו או בוטלו ההגנות על התעשייה, נמכרו חברות ממשלתיות, חוסלו מערכות סבסוד וניתן חופש פעולה מונטרי לבנק המרכזי.",BEFORE
30.0.14,30,0,14,"יש כמה עסקני ספורט, בעיקר הוותיקים והמשופשפים שבהם, המתפקדים תחת לחץ כאילו הזמן אוזל ויש להספיק לעשות הכל ומהר ובכל מחיר. הם מציירים מטרות על הגלובוס, ואחר כך [א1] מוצאים [/א1] סיבות שונות [א2] ומשונות [/א2] להגיע אל המטרה.",EQUAL
50.1.10,50,1,10," חניכיו של יורם חרוש ניצחו במשחק המרכזי של המחזור ה-8 את סגן האלוף מהצפון 67 70, לאחר מאבק מורט עצבים, [א1] שנסתיים [/א1] בתקרית מכוערת מאחורי הקלעים. אחרי הניצחון על מכבי תל אביב במוצאי שבת, [א2] נראה [/א2] לשחקני הגליל שהם בדרך הנכונה, אבל לירושלים ששמרה על הפיסגה, יעדים משלה.",AFTER
29.2.5,29,2,5," עירוני, שמאמנו הוא אריה רדלר, [א1] הפתיע [/א1] בסידרה של ארבעה ניצחונות. השג מצוין זה הציבו בראש הטבלה לפני מועדונים ותיקים כמו היורדים הפועל רמת גן ושמשון תל אביב, מכבי פתח תקוה ומכבי יבנה (היחיד [א2] שניצח [/א2] את עירוני).",AFTER
33.14.46,33,14,46," כוויית היא אוסטריה, וכמסתמא אפילו ברנאדט [א1] שכח [/א1] אולי רצה לשכוח כיצד מתקדם הטור הפוליטי בנוסח שנות ה03. היו זמנים שחיילים בארצות שבהן [א2] נכפפו [/א2] אנשי צבא לאזרחים עסקו בשלהם, והותירו את הפוליטיקה לממונים הפוליטיים.",AFTER
34.15.45,34,15,45," אבל אפשר שהאמריקאים לומדים בימים אלה פרק חשוב בהבנת המזרח התיכון. התנהגותם [א1] מזכירה [/א1] פוליטיקאים ישראלים (ביניהם כאלה [א2] הלועגים [/א2] היום לחיזור האמריקאי אחרי הקואליציה הערבית) זוללי שרימפס, החובשים כיפה על ראשם ומשחרים לפתחם של רבנים אנטי-ציונים.",AFTER
54.47.261,54,47,261," חברי ההנהלה, לטענת המבקרים, [א1] משחקים [/א1] ""ראש קטן"", כל אחד לעצמו. עכשיו כשפרץ במלוא עוצמתו הסכסוך עם העובדים [א2] עומדים [/א2] רוב חברי ההנהלה מן הצד ואינם מתערבים, טוענים העובדים.",BEFORE
96.3.31,96,3,31," בפנייתו לחברי ההתאחדות אומר נשיא הקבלנים, מרדכי יונה, כי הדרך של פנייה מרוכזת של החברים דרך ההתאחדות [א1] מבטיחה [/א1] ליווי צמוד לכל בקשה עד מילויה. בהתאחדות [א2] משוכנעים [/א2] כי בדרך זו יוכל משרד הבינוי והשיכון לטפל במרוכז בכל ההצעות ולא ידחה בקשות פרטניות בשל חוסר כוח-אדם לטיפול בבקשות אלה.",BEFORE
135.16.46,135,16,46," היות שהתכוונתי לתת את הפירות במתנה, התקשרתי בערב אל מנהל החנות [א1] ושאלתי [/א1] אם יוכל לשלוח לי ביום ששי שקדים ואגוזי לוז טריים (אין לי מכונית והחנות רחוקה מביתי). ביום ששי בצהריים [א2] בא [/א2] שליח מיוחד מהחנות והביא ארבע אריזות, שבכל אחת מהן רבע ק""ג פיצוחים, שקדים, אגוזים וכו, קלופים ומצוינים.",BEFORE
111.5.46,111,5,46," לטובת חיפה שיחקו גם שלוש קבוצות צמרת הצמודות אליו, שהפסידו [א1] ואיפשרו [/א1] לחיפאים לנצל את ההזדמנות הזו במלואה. אל המקום השני נסוג בית""ר ירושלים, [א2] שירד [/א2] לנגב ואיפשר למארחו בבאר שבע להשיג את ניצחונו הראשון העונה (2 0), אחרי סידרה בלעדית מפתיעה של 5 תיקו בזה אחר זה.",BEFORE
26.9.38,26,9,38," ואף אם נאמרים דברים נדושים, השפה הצרפתית ודרך הביטוי מעניקים להם משמעות מיוחדת [א1] העטופה [/א1] בהילה של תרבות. הצרפתים, לא רק שהם אינם מתעבים את המלה ""תרבות"", נראה כאילו הם [א2] המציאו [/א2] את המושג הזה.",AFTER
34.22.103,34,22,103," אף שארה""ב התנגדה מאז ומתמיד לצעדי הסיפוח של ישראל, היא לא השכילה להבין כי בהטילה שוב ושוב וטו על החלטות האו""ם, היא מרגילה את הציבור הישראלי להאמין שאפשר להשליך הצדה את הצהרותיה באותו עניין עצמו. בהרצאה שנשא בחודש מארס [א1] טען [/א1] פרופסור יהושפט הרכבי כי בכך [א2] איפשרה [/א2] ארה""ב לממשלות ישראל ולציבור בארץ לבצע משגים, שיום אחד הם אלה שייאלצו לשלם את המחיר בעבורם.",AFTER
8.0.17,8,0,17,"מזכירות איגוד הפועלים החקלאיים הציעה אתמול שהממשלה תשלם מענק חודשי של 500 ש""ח, [א1] נוסף [/א1] לשכר הרגיל, לכל ישראלי שיעבוד בקטיף ההדרים במשך שלושה חודשים לפחות. מזכיר איגוד הפועלים החקלאיים, חיים אביבי, מסר שההצעה הועלתה לנוכח המחסור בעובדי קטיף המורגש כבר כעת [א2] ויוחרף [/א2] בחודש הבא, כשהקטיף יהיה בעיצומו, בעיקר עקב היעדרות עובדים מהשטחים.",VAGUE
54.48.268,54,48,268," עכשיו כשפרץ במלוא עוצמתו הסכסוך עם העובדים [א1] עומדים [/א1] רוב חברי ההנהלה מן הצד ואינם מתערבים, טוענים העובדים. ובינתיים [א2] ממשיך [/א2] ועד העובדים להמטיר על חבריו חוזרים המופנים נגד ההנהלה.",AFTER
122.4.56,122,4,56," הלקוחה, שכרבים אחרים אינה [א1] מתמצאת [/א1] בנבכי תוכניות החיסכון ותנאיהן המורכבים, פנתה לסניף לקבל הסברים נוספים, ושם ציפו לה הפתעות אחדות. ראשית, כך הבינה, אין [א2] המדובר [/א2] למעשה בתוכנית המשך, אלא בתוכנית חיסכון רגילה.",VAGUE
54.8.53,54,8,53," בכירים במחנה לוי, שראו כיצד מתייחס שרון אל סלוצקי, הביעו כעס רב על שר החוץ, ש""נטש חלק מנאמני המחנה [א1] המכהנים [/א1] במשרות בכירות בחברות השיכון הממשלתיות ובמשרד השיכון"" כדבריהם. הם טענו כי מעמדם נמצא עתה בסכנה, עקב קירבתם ללוי, וכי שר החוץ עצמו אינו [א2] נחלץ [/א2] להגן עליהם.",BEFORE
22.9.43,22,9,43," כהנא אומר בו לערבים שהוא איננו שונא אותם. הוא [א1] אוהב [/א1] יהודים ומבין בהחלט שהערבים [א2] מתעבים [/א2] את היהודים, ורואים בהם זרים שבאו להשתלט על ארצם ועל אדמתם.",EQUAL
133.43.175,133,43,175," מי שחולש על הכספים הוא ראש העיר הקשור בארגוני הפשע. חלק חשוב מהתקציבים שאושרו בזמנו [א1] מופקדים [/א1] בבנקים [א2] המקורבים [/א2] לראש הממשלה לשעבר, הדמו-נוצרי דא מיטה, בן האזור.",AFTER
31.19.179,31,19,179," [א1] נשמעה [/א1] הטענה שכל תאגיד חייב לשלם את התעריף המקובל לעבודה, כשם שהוא חייב לשלם את המחיר המקובל תמורת מים, חשמל או חומרי גלם. אם [א2] יחויב [/א2] לנהוג כך, תעמוד בפניו הברירה של הקטנת העלות הכוללת באמצעות צמצום היקף ההזדקקות למשאב היקר.",BEFORE
122.15.347,122,15,347," לא מי-יודע-מה בהשוואה לציפיות המתעוררות בלב לקוח תמים למקרא הודעת הבנק! לעומת זאת, הלקוח התמים יתקשה להבין מהודעת הבנק, שאם יסכים לקבל את ""התנאים [א1] הניתנים [/א1] לחוסכים ותיקים בלבד"", יפסיד במעבר מתוכנית לתוכנית. במקרה של הלקוחה הנ""ל היה מדובר במדד אוקטובר, הנאמד בכשני אחוזים [א2] ושקול [/א2] כנגד ריבית של שנתיים.",VAGUE
70.3.18,70,3,18," זהו הדיווח השני, בשבוע האחרון של כתב אמריקאי מישראל, האומר כי ישראל מודאגת מהיעדר תיכנון משותף בין ואשינגטון לירושלים בדבר אפשרות שידרש תיאום בין שתי המדינות, אם [א1] יפרוץ [/א1] עימות צבאי במפרץ. כתב העיתון מדווח, מפי פקידים בממשלת ישראל, כי אין כרגע מנגנון של תקשורת ותיאום משותף במישור הצבאי, וכי ""צריך למסד מנגנון כלשהו של תקשורת בין פקידים בכירים משני הצדדים, אשר [א2] ישמש [/א2] במקרה של משבר"".",BEFORE
