id,document_number,window_number,pair_number,text,label
31.1.23,31,1,23," בשנת 4891 עלתה שם לשלטון מפלגת העבודה [א1] וחוללה [/א1] מהפך בלתי צפוי. במקום להגביר את מעורבות הממשלה במשק, להגדיל את הריכוז ולחזק את הפיקוח על הפעילות הכלכלית, היא הנהיגה ליברליזציה מרחיקת-לכת: הוחלה רפורמה נדיבה במערכת המיסוי, צומצמו או בוטלו ההגנות על התעשייה, נמכרו חברות ממשלתיות, חוסלו מערכות סבסוד [א2] וניתן [/א2] חופש פעולה מונטרי לבנק המרכזי.",EQUAL
86.1.28,86,1,28," אגמי טען כי על ממשלת ישראל להעניק לחברות הבנייה בישראל מענקים לעידוד הכנת טכנולוגיות חדשות לענף, ואת עובדי הבנין לעודד על ידי שכר מועדף ומוגדל שיועבר ישירות לעובד, ולא לחברות הבנייה. בישיבה השבועית של מזכירות ההסתדרות במרחב חיפה [א1] שהתקיימה [/א1] אתמול נמסר כי בשבועיים האחרונים חלה עלייה בדרישה לפועלים בענף הבנייה, לרבות דרישה לפועלים בלתי מקצועיים, אך נוכח השכר הנמוך המוצע [א2] לדורשי [/א2] העבודה, ההענות היתה מעטה.",AFTER
92.10.29,92,10,29," עם זאת, נמנעו חברות הביטוח מלנקוט בצעדים נגד הסוכנות בגלל היקפי ביטוח חיים הגדולים שסוכנות זו מוכרת. באחרונה [א1] הגיעה [/א1] הקרן להסכם עם אחד המפעלים הגדולים [א2] המתמחים [/א2] בתעשייה עתירת-ידע, לפיו 1,000 העובדים בו יצטרפו לקרן.",AFTER
135.1.12,135,1,12," היבואן צוטט באומרו כי ""אכן מדובר באותו מפעל ואפילו במוצרים זהים"". ברצוני להבהיר חד משמעית, שבמפעל של לנקום, אשר [א1] נמצא [/א1] בקודרי בצפון צרפת, לא [א2] מיוצרים [/א2] מוצרי גמיי.",BEFORE
133.12.22,133,12,22," קבוצות רבות נאבקות ביניהן על השליטה בסחר הסמים והנשק ועל המכרזים הציבוריים הגדולים, [א1] שמזרימים [/א1] לאזור אלפי מיליארדים של לירטות מקופת המדינה ומהשוק המערב אירופי. בין הנרצחים לא רק אנשי הפשע אלא רבים מאלה [א2] העומדים [/א2] בדרכו.",VAGUE
22.10.56,22,10,56," הוא [א1] אוהב [/א1] יהודים ומבין בהחלט שהערבים מתעבים את היהודים, ורואים בהם זרים שבאו להשתלט על ארצם ועל אדמתם. ""כיהודי מאמין אני עושה את מה שמצווה עלי התורה ואת מה שדורש ממני אלוהים"", [א2] אמר [/א2] כהנא.",BEFORE
120.3.7,120,3,7," ועדה ובה אמנים, בעלי גלריות ונציגי הבנק בחרה אמנים [א1] שישתתפו [/א1] באלבום. ""הבחירה [א2] מנסה [/א2] לתת מגוון מייצג של האמנות הישראלית בתקופה בה יצא האלבום"", אומרת ציפורה אנגלמן, ממנהלות הפרויקט.",AFTER
77.2.6,77,2,6," ומבקרים בהן מדי יום כ2,000 איש [א1] הסובלים [/א1] מבעיות בפרקים, כאבי גב וכיוצא באלה. ההשקעה עליה [א2] הוחלט [/א2] בקיבוץ הארצי נועדה להקמתם של מכון לטיפולים הידרותרפיים, סאונה, בית מרחץ ומסעדה.",BEFORE
8.0.15,8,0,15,"מזכירות איגוד הפועלים החקלאיים הציעה אתמול שהממשלה תשלם מענק חודשי של 500 ש""ח, [א1] נוסף [/א1] לשכר הרגיל, לכל ישראלי שיעבוד בקטיף ההדרים במשך שלושה חודשים לפחות. מזכיר איגוד הפועלים החקלאיים, חיים אביבי, מסר שההצעה [א2] הועלתה [/א2] לנוכח המחסור בעובדי קטיף המורגש כבר כעת ויוחרף בחודש הבא, כשהקטיף יהיה בעיצומו, בעיקר עקב היעדרות עובדים מהשטחים.",AFTER
128.28.158,128,28,158," טיב ההסכם לא נודע, אך הגיבור המגמגם מת מיתה [א1] משונה [/א1] עוד באותו פרק. בדרך לדוכנים קרה כנראה משהו לספר הזה, שתרגומו לעברית ראה אור ב5591, שכן הוא אינו [א2] מופיע [/א2] כלל בקטלוג של הספרייה הלאומית בירושלים (כל מי שהיה לו עסק בזמן זה או אחר עם הספרייה הלאומית, יודע שיש שם פער עצום בין הרשום בקטלוג לבין הספרים שניתן להשיג בפועל; אך הקטלוג עצמו, לפחות, אמור להיות מושלם) ואף לא בלקסיקון של אוריאל אופק לספרות ילדים.",BEFORE
34.2.4,34,2,4," הכתבים [א1] נאלצו [/א1] להתחייב שלא להקרין תמונות של נשים בצד גברים, ולדלג על איברים חשופים. נציג אחת הרשתות [א2] שסיפר [/א2] לי את הסיפור מעיד, שהמראה בחוף תל אביב נועז פי כמה ממה שהרשו לעצמן עקרות הבית האמריקאיות שהופיעו באותו ליל חמסין סעודי בשגרירות ארה""ב.",BEFORE
48.8.102,48,8,102," סל רדף סל ובדקה ה-83 הורה לוח התוצאות על שוויון 18, 75 שניות לסיום היה להפועל יתרון 77 79, וכשנותרה שנייה לסיום נשרקה עבירה טכנית לזכות קרטר מרמת גן והוא [א1] הישווה [/א1] בשתי זריקות עונשין. הוצאת הכדור בידי רמת גן שנייה לסיום לא שינתה דבר והקבוצות [א2] התייצבו [/א2] להארכה.",BEFORE
60.3.76,60,3,76," לדבריו הוקם באלביט גוף שמפקח על הקניות ובודק כל הזמנה המיועדת לחו""ל, אם ניתן לרכוש אותה בארץ. עוד [א1] נמסר [/א1] כי אלביט תעביר לרשות לשיתוף פעולה את רשימות החברות בחו""ל שמהן היא קונה מוצרים, כדי שהרשות [א2] תפעל [/א2] להשגת רכש גומלין מאותן חברות.",BEFORE
31.5.115,31,5,115," מאז הונהגו הרפורמות באמצע שנות השמונים סובלת ניו זילנד מקיפאון כלכלי, התוצר הלאומי כמעט שלא עלה, ושיעור האבטלה מתקרב לשמונה אחוזים שיא של כל הזמנים במדינה זו. מדוע [א1] נכשלה [/א1] המדיניות, ובעיקר בתחום התעסוקה? השבועון ""אקונומיסט"" משוכנע כי ההסבר העיקרי הוא שממשלת ניו זילנד היתה נועזת, אך לא נועזת דיה: היא נמנעה מלטפל בהיבט חיוני שבלעדיו לא [א2] תצליח [/א2] שום רפורמה, דהיינו מערכת העבודה, השכר והאיגוד המקצועי.",EQUAL
34.26.136,34,26,136," נהפוך הוא: ככל [א1] שחולף [/א1] הזמן ירבו ההתנחלויות היהודיות ויגבר הפונדמנטליזם האיסלמי. התנהגותה של ארצות הברית במועצת הביטחון בפרשת הר הבית (נתניהו טוען שהאמריקאים אינם נבהלים גם מהרעיון לכנס לראשונה בתולדות אמנת זנווה את המדינות החתומות עליה), הנחישות שגילה הממשל בעניין הכוונת העולים והכספים לישראל בגבולותיה המצומצמים ייתכן שאלה עדויות ראשונות לכך שהממשל [א2] מבין [/א2] לא רק את אילוצי הקואליציה שלו עם המוסלמים האדוקים.",BEFORE
54.22.106,54,22,106," אולם שר התעשיה והמסחר משה נסים, שהיה שותף בצוות המו""ם עם אגו""י והמפלגות הדתיות, אינו מעוניין בסגן שר במשרדו, וגם ארנס אינו [א1] מתלהב [/א1] יותר מדי להצעה כזו. עד [א2] שיזכה [/א2] ביבי במשרה שתיראה לו הודיעה המפד""ל לשמיר כי נציגה בוועדת הכספים, ח""כ ביבי, לא יתמוך במתן משרת יו""ר הועדה לאגו""י וללא קולו יתקשה הליכוד בהשגת רוב בוועדה להחלפת היו""ר.",BEFORE
60.1.10,60,1,10," כך [א1] מסר [/א1] חיים גולן, מנהל הרשות לשיתוף פעולה, שחזר מביקור בחברה. גולן [א2] הביע [/א2] שביעות-רצון מהדרך בה פועלת אלביט, כמפעל פרטי ראשון שקיבל על עצמו, מרצונו, את העקרונות שעל-פיהם עובדת הרשות לשיתוף פעולה תעשייתי.",EQUAL
34.25.126,34,25,126," לדעתו, דחייה לא תשפר את המצב. נהפוך הוא: ככל שחולף הזמן [א1] ירבו [/א1] ההתנחלויות היהודיות [א2] ויגבר [/א2] הפונדמנטליזם האיסלמי.",EQUAL
35.9.13,35,9,13, קליוולנד [א1] גברה [/א1] על שארלוט 001 98 ודטרויט התאוששה מההפסד בסיאטל עם ניצחון גדול על הקליפרס בלוס אנגלס 011 38 (דומארס 25 נק). פיניקס סאנס [א2] ניצחו [/א2] בביתם את גולדן סטייט 119 126 (אדי גונסון קלע 53 לפיניקס).,VAGUE
54.49.275,54,49,275," ובינתיים [א1] ממשיך [/א1] ועד העובדים להמטיר על חבריו חוזרים המופנים נגד ההנהלה. בחוזר שהופץ לפני ימים מספר בין כל עובדי הבנק נאמר, בין השאר, כי ב""מפעל סולתם שיסתה ההנהלה כלבים בעובדים, וכאן היא [א2] משסה [/א2] קבוצות עובדים אחת בשנייה.",VAGUE
98.2.16,98,2,16," רובינסון [א1] נתמכה [/א1] רשמית על ידי שתי מפלגות שמאל הלייבור והוורקרס כלומר מפלגת העבודה והסוציאליסטים. אולם 25% מן הקולות בהם זכתה בסיבוב השני של הבחירות, [א2] המבוססות [/א2] על שיטה מסובכת למדי, משקפים הרבה מעבר לכוחן של שתי המפלגות גם יחד.",AFTER
54.3.15,54,3,15," בינתיים פג מינויו של סלוצקי כמנהל-בפועל, ושרון [א1] סירב [/א1] להאריך את מינויו. במקומו מינה את סגנו, וילי קרף, שאף הוא [א2] מתמודד [/א2] במכרז, שתוצאותיו ייוודעו ב-82 בחודש זה.",BEFORE
69.2.9,69,2,9," ישתתף בה גם, שלמרות סיום תפקידו כיו""ר הדירקטוריון, [א1] החליט [/א1] להמשיך לכהן כדירקטור. קפכות מזכ""ל ההסתדרות,, [א2] העיר [/א2] מתרדמתם את באי יום העיון של המרכז הישראלי לניהול.",VAGUE
31.2.83,31,2,83," במקום להגביר את מעורבות הממשלה במשק, להגדיל את הריכוז ולחזק את הפיקוח על הפעילות הכלכלית, היא הנהיגה ליברליזציה מרחיקת-לכת: הוחלה רפורמה נדיבה במערכת המיסוי, צומצמו או בוטלו ההגנות על התעשייה, נמכרו חברות ממשלתיות, חוסלו מערכות סבסוד וניתן חופש פעולה מונטרי לבנק המרכזי. שוחרי השוק החופשי ותומכי ההתערבות הממשלתית גם יחד [א1] התבוננו [/א1] בהשתאות אל הנעשה בארץ הקיווי: האם תגשים דווקא מפלגה סוציאל-דמוקרטית את חזונו של מילטון פרידמן? בחודש שעבר, כתום קרוב לשש שנות שלטון, בעטו בוחרי ניו-זילנד במפלגת העבודה, [א2] והחזירו [/א2] לשלטון את המפלגה השמרנית.",BEFORE
26.8.24,26,8,24," לא רק שהם [א1] אוהבים [/א1] את שפתם, אלא הם גם בעלי כושר ביטוי מעולה. ואף אם [א2] נאמרים [/א2] דברים נדושים, השפה הצרפתית ודרך הביטוי מעניקים להם משמעות מיוחדת העטופה בהילה של תרבות.",BEFORE
30.2.19,30,2,19," כך [א1] נראה [/א1] גם רצונו של מנכ""ל ההתאחדות לספורט שמואל ללקין לנסוע לקונגרס איגרוף, שיהיה בשבוע הבא באוסטרליה. התנגדותם לנסיעה זו של כמה מראשי האיגודים המסונפים להתאחדות, שפעילותם [א2] נפגעת [/א2] בגלל קשיי מימון וחוסר תקציב, מובנת בהחלט וגם מוצדקת לחלוטין.",AFTER
8.0.18,8,0,18,"מזכירות איגוד הפועלים החקלאיים הציעה אתמול שהממשלה תשלם מענק חודשי של 500 ש""ח, נוסף לשכר הרגיל, לכל ישראלי [א1] שיעבוד [/א1] בקטיף ההדרים במשך שלושה חודשים לפחות. מזכיר איגוד הפועלים החקלאיים, חיים אביבי, [א2] מסר [/א2] שההצעה הועלתה לנוכח המחסור בעובדי קטיף המורגש כבר כעת ויוחרף בחודש הבא, כשהקטיף יהיה בעיצומו, בעיקר עקב היעדרות עובדים מהשטחים.",AFTER
122.13.228,122,13,228," במה מתבטא ה""המשך"", כלומר, מה הם ה""תנאים הניתנים לחוסכים ותיקים בלבד"" בתוכניות ההמשך? בהודעת הבנק מדובר בלשון רבים, אבל למעשה יש רק תנאי משופר אחד: כל המועדים מוקדמים בשנה אחת. לדוגמה, אם בתוכנית רגילה יכול החוסך לצאת מן התוכנית כעבור שנתיים, כאשר הבנק [א1] משלם [/א1] לו 59% מן הריבית וההצמדה שנצברו בתכנית ""המשך"" הוא רשאי לצאת עם נזק כנ""ל כבר אחרי שנה אחת; אם בתוכנית הרגילה יקבל החוסך ריבית שנתית בשיעור של אחוז שלם (ולא חצי אחוז, כפי [א2] שהבינה [/א2] החוסכת בטעות) לאחר שיתמיד בחיסכון שלוש שנים חוסך בתוכנית המשך יתעשר באחוז אחד לשנה כבר אחרי שנתיים.",VAGUE
31.1.21,31,1,21," בשנת 4891 עלתה שם לשלטון מפלגת העבודה [א1] וחוללה [/א1] מהפך בלתי צפוי. במקום להגביר את מעורבות הממשלה במשק, להגדיל את הריכוז ולחזק את הפיקוח על הפעילות הכלכלית, היא הנהיגה ליברליזציה מרחיקת-לכת: הוחלה רפורמה נדיבה במערכת המיסוי, צומצמו או בוטלו ההגנות על התעשייה, [א2] נמכרו [/א2] חברות ממשלתיות, חוסלו מערכות סבסוד וניתן חופש פעולה מונטרי לבנק המרכזי.",EQUAL
131.46.122,131,46,122," לו רק היה הימין סומך קצת על השמאל [א1] שיעזור [/א1] לו להשתחרר מהפחד, היינו כולנו נשכרים. תל-אביב: ח""כ יוסי שריד הודיע לאחרונה כי טעה כאשר [א2] התנגד [/א2] להפצצת הכור האטומי בעיראק.",VAGUE
48.5.72,48,5,72," שחקני החיזוק הולקומב ופירסון עשו את המוטל עליהם וקלעו את מיכסת הנקודות שמצפים מהם (ביחד 94 נקודות). האכזבה באה דווקא מבינו, שלא [א1] הצליח [/א1] להתמודד עם גבוהי הפועל, ומעושה המשחק שוורצמן [א2] שאיבד [/א2] כדורים רבים.",EQUAL
54.30.161,54,30,161," הוא טען כי יו""ר הסיעה ח""כ שרה דורון [א1] הכחישה [/א1] באוזניו את הטענה כי אי מינויו לוועדת חוץ וביטחון הוא עונש פוליטי. ריבלין האשים ""ח""כים ירושלמים (קרי: הנגבי, קורפו, ויהושע מצא) [א2] המנצלים [/א2] את מעמדם בהנהלת הסיעה, כדי למנוע כל אפשרות שיכהן בחבר בוועדת חוץ וביטחון.",AFTER
133.43.172,133,43,172," מי שחולש על הכספים הוא ראש העיר [א1] הקשור [/א1] בארגוני הפשע. חלק חשוב מהתקציבים שאושרו בזמנו מופקדים בבנקים [א2] המקורבים [/א2] לראש הממשלה לשעבר, הדמו-נוצרי דא מיטה, בן האזור.",VAGUE
122.13.239,122,13,239," במה מתבטא ה""המשך"", כלומר, מה הם ה""תנאים הניתנים לחוסכים ותיקים בלבד"" בתוכניות ההמשך? בהודעת הבנק מדובר בלשון רבים, אבל למעשה יש רק תנאי משופר אחד: כל המועדים מוקדמים בשנה אחת. לדוגמה, אם בתוכנית רגילה יכול החוסך לצאת מן התוכנית כעבור שנתיים, כאשר הבנק משלם לו 59% מן הריבית וההצמדה [א1] שנצברו [/א1] בתכנית ""המשך"" הוא רשאי לצאת עם נזק כנ""ל כבר אחרי שנה אחת; אם בתוכנית הרגילה יקבל החוסך ריבית שנתית בשיעור של אחוז שלם (ולא חצי אחוז, כפי שהבינה החוסכת בטעות) לאחר שיתמיד בחיסכון שלוש שנים חוסך בתוכנית המשך [א2] יתעשר [/א2] באחוז אחד לשנה כבר אחרי שנתיים.",VAGUE
31.6.138,31,6,138," מדוע נכשלה המדיניות, ובעיקר בתחום התעסוקה? השבועון ""אקונומיסט"" משוכנע כי ההסבר העיקרי הוא שממשלת ניו זילנד היתה נועזת, אך לא נועזת דיה: היא נמנעה מלטפל בהיבט חיוני שבלעדיו לא תצליח שום רפורמה, דהיינו מערכת העבודה, השכר והאיגוד המקצועי. בתחום זה לא נעשה דבר: הסכמי העבודה [א1] נשארו [/א1] קשוחים כשהיו, השכר [א2] נקבע [/א2] בשיטות ריכוזיות על בסיס הצמדות וללא כל זיקה למצב בשוק העבודה, והאיגודים המקצועיים המשיכו להפעיל זכויות בלעדיות במשא ומתן עם המעסיקים על מקומות העבודה ותנאיה, תוך התעלמות ממצב המשק.",EQUAL
29.9.24,29,9,24," מהרכב עירוני עלול להיעדר החלוץ המצטיין נאור גלילי, [א1] המוביל [/א1] בטבלת מלך השערים. גלילי [א2] נפצע [/א2] במשחק האחרון נגד הפועל חדרה.",BEFORE
122.15.339,122,15,339," לא מי-יודע-מה בהשוואה לציפיות המתעוררות בלב לקוח תמים למקרא הודעת הבנק! לעומת זאת, הלקוח התמים [א1] יתקשה [/א1] להבין מהודעת הבנק, שאם יסכים לקבל את ""התנאים הניתנים לחוסכים ותיקים בלבד"", יפסיד במעבר מתוכנית לתוכנית. במקרה של הלקוחה הנ""ל היה [א2] מדובר [/א2] במדד אוקטובר, הנאמד בכשני אחוזים ושקול כנגד ריבית של שנתיים.",VAGUE
86.0.4,86,0,4,"מזכיר ההסתדרות במרחב חיפה, אורי אגמי, תובע בפנייה לשר העבודה והרווחה להכריז על מקצועות הבנייה כמקצועות מועדפים, שיש להפנות אליהם משאבים, ובכך להפכם למקצועות [א1] נדרשים [/א1] על ידי חיילים משוחרררים ועולים חדשים. אגמי [א2] טען [/א2] כי על ממשלת ישראל להעניק לחברות הבנייה בישראל מענקים לעידוד הכנת טכנולוגיות חדשות לענף, ואת עובדי הבנין לעודד על ידי שכר מועדף ומוגדל שיועבר ישירות לעובד, ולא לחברות הבנייה.",AFTER
26.9.36,26,9,36," ואף אם נאמרים דברים נדושים, השפה הצרפתית ודרך הביטוי מעניקים להם משמעות מיוחדת [א1] העטופה [/א1] בהילה של תרבות. הצרפתים, לא רק שהם אינם [א2] מתעבים [/א2] את המלה ""תרבות"", נראה כאילו הם המציאו את המושג הזה.",AFTER
128.7.55,128,7,55," אלכסנדר דיומא הבן, מחבר ""הגברת עם הקמליות"", ישב בקהל, ובלהט הויכוח [א1] קרא [/א1] לעבר אביו, שהיה על הבמה: ""זו היצירה הכי גרועה שלך, פאפא"". האב לא איבד את שלוות רוחו, [א2] שלח [/א2] אצבע ארוכה לעבר בנו, וקרא: ""יש לי רק יצירה אחת גרועה ממנה, וזה אתה"".",BEFORE
122.17.359,122,17,359," פרט קטן. המוזר הוא, שאותו בנק לאומי (כמוהו כבנק מזרחי) [א1] מציע [/א1] לחוסך תוכנית צמודת-מדד שבה הפסד מדד, אך בלי שייהנה מהתנאים [א2] הניתנים [/א2] לחוסכים ותיקים בלבד"", כלומר הקדמת מועדים בשנה אחת.",VAGUE
33.14.44,33,14,44," כוויית היא אוסטריה, [א1] וכמסתמא [/א1] אפילו ברנאדט שכח אולי רצה לשכוח כיצד מתקדם הטור הפוליטי בנוסח שנות ה03. היו זמנים שחיילים בארצות שבהן נכפפו אנשי צבא לאזרחים [א2] עסקו [/א2] בשלהם, והותירו את הפוליטיקה לממונים הפוליטיים.",AFTER
122.13.215,122,13,215," במה מתבטא ה""המשך"", כלומר, מה הם ה""תנאים הניתנים לחוסכים ותיקים בלבד"" בתוכניות ההמשך? בהודעת הבנק מדובר בלשון רבים, אבל למעשה יש רק תנאי משופר אחד: כל המועדים [א1] מוקדמים [/א1] בשנה אחת. לדוגמה, אם בתוכנית רגילה יכול החוסך לצאת מן התוכנית כעבור שנתיים, כאשר הבנק משלם לו 59% מן הריבית וההצמדה שנצברו בתכנית ""המשך"" הוא רשאי לצאת עם נזק כנ""ל כבר אחרי שנה אחת; אם בתוכנית הרגילה יקבל החוסך ריבית שנתית בשיעור של אחוז שלם (ולא חצי אחוז, כפי שהבינה החוסכת בטעות) לאחר שיתמיד בחיסכון שלוש שנים חוסך בתוכנית המשך [א2] יתעשר [/א2] באחוז אחד לשנה כבר אחרי שנתיים.",EQUAL
124.37.134,124,37,134," הוא עמד לקחת את בנותיו במכונית לטורקיה כדי להשיא אותן שם. בגבול גרמניה-אוסטריה לינדאו-ציגלהאוז התעוררה אסומן, יצאה מהמכונית [א1] שנסעה [/א1] לאיטה בתחבורה העמוסה וקראה לעובדי המכס, ""הצילו אותנו, אבא [א2] חוטף [/א2] אותנו"".",AFTER
2.1.16,2,1,16," למרות שחלפו מאז 24 שנה, ולמרות שאירועי ימים אלה אולי מאפילים על כל דבר אחר, אני מרגיש חובה בשמם של החללים, הפצועים ולוחמי הקרב הזה, כאחד שהיה שם, להתייחס למאמר. קטעי המאמר [א1] העוסקים [/א1] בקרב עצמו, ושרק אליהם אתייחס, מאופיינים בחוסר היגיון ובסילוף עובדות, [א2] ומעידים [/א2] על הכותב כי הוא משולל הבנה טקטית מינימלית וניסיון קרבי משמעותי.",EQUAL
22.9.36,22,9,36," כהנא [א1] אומר [/א1] בו לערבים שהוא איננו שונא אותם. הוא אוהב יהודים ומבין בהחלט שהערבים מתעבים את היהודים, ורואים בהם זרים [א2] שבאו [/א2] להשתלט על ארצם ועל אדמתם.",AFTER
128.0.9,128,0,9,"המוסקטרים "", הלך לעולמו בשנת 0781, בגיל ששים ושמונה, כשהוא מותיר אחריו יבול ספרותי שכונס בלא פחות מ003 כרכים. ידוע, כי לא כל מה [א1] שפורסם [/א1] בשמו אכן [א2] כתב [/א2] במו ידיו.",AFTER
31.0.9,31,0,9,באמצע שנות השמונים ציפו רבים כי הבשורה תצא מניו זילנד הרחוקה. בשנת 4891 [א1] עלתה [/א1] שם לשלטון מפלגת העבודה [א2] וחוללה [/א2] מהפך בלתי צפוי.,BEFORE
124.20.66,124,20,66, אישה בת 24 [א1] באה [/א1] למרפאה שם התלמדה בתה בת ה91 כאסיסטנטית רפואית וניסתה לדקור אותה בסכין לחם. הנערה [א2] סירבה [/א2] לעטות מטפחת ראש ושכנים כינו אותה זונה.,AFTER
