id,document_number,window_number,pair_number,text,label
31.2.65,31,2,65," במקום להגביר את מעורבות הממשלה במשק, להגדיל את הריכוז ולחזק את הפיקוח על הפעילות הכלכלית, היא הנהיגה ליברליזציה מרחיקת-לכת: הוחלה רפורמה נדיבה במערכת המיסוי, צומצמו או בוטלו ההגנות על התעשייה, [א1] נמכרו [/א1] חברות ממשלתיות, חוסלו מערכות סבסוד וניתן חופש פעולה מונטרי לבנק המרכזי. שוחרי השוק החופשי ותומכי ההתערבות הממשלתית גם יחד [א2] התבוננו [/א2] בהשתאות אל הנעשה בארץ הקיווי: האם תגשים דווקא מפלגה סוציאל-דמוקרטית את חזונו של מילטון פרידמן? בחודש שעבר, כתום קרוב לשש שנות שלטון, בעטו בוחרי ניו-זילנד במפלגת העבודה, והחזירו לשלטון את המפלגה השמרנית.",BEFORE
100.15.9,100,15,9," בתחרות לזוגות [א1] ניצחו [/א1] ויידנפלד ועמית נאור את מרנשטיין ואורן מוטווסל 62, 64. קפספקו עולה מבריה""ם [א2] קבע [/א2] בשבת הישג טוב ב-8 נקודות מהשיא הלאומי באקדח אוויר לאחר שצבר 775 נקודות (השיא הקודם: רוני מנדלמן 965 נקודות).",VAGUE
122.1.15,122,1,15," בהמשך נאמר, בין השאר, כי ""מועדי היציאה הגמישים של כוח תשורת המשך [א1] הופכים [/א1] את התוכנית לאטרקטיווית"". להלן [א2] הודיע [/א2] הבנק ללקוחה כי יעביר את הכספים שהצטברו לזכותה, כולל כל ההטבות, לתוכנית חדשה (""כוח תשורת המשך""), כאשר המדד היסודי לגבי התוכנית החדשה יהיה המדד שיפורסם בגין אוקטובר 0991.",VAGUE
8.3.53,8,3,53," בשבוע הבא ידון מנכ""ל התאחדות האיכרים, שלמה רייזמן, עם מנכ""ל שירות התעסוקה, דוד מנע, בדרישת ההתאחדות לשכנע עולים חדשים [א1] הלומדים [/א1] באולפנים לעבוד בקטיף. רייזמן מציע שהממשלה [א2] תסבסד [/א2] מחצית מעלות העסקתם של העולים בקטיף.",BEFORE
77.1.3,77,1,3," באתר יש שש בריכות מקורות עם מי גופרית המנוצלים למטרות מרפא. [א1] ומבקרים [/א1] בהן מדי יום כ2,000 איש [א2] הסובלים [/א2] מבעיות בפרקים, כאבי גב וכיוצא באלה.",AFTER
42.2.24,42,2,24," קבלו אמר שהנהלת הפועל בית שאן מתייחסת בחומרה רבה [א1] ומביעה [/א1] שאט נפש מהרעיון של כמה שחקני הקבוצה לעמוד דקת דומיה ולענוד סרט שחור במשחק נגד אום אל-פאחם. מזכיר מועצת הפועלים והנהלת הפועל בית שאן, [א2] הודיעו [/א2] שהשחקנים שנטלו עליהם יוזמה אישית, בניגוד לדעת ההנהלה, יועמדו לבירור משמעתי.",BEFORE
133.32.115,133,32,115," על הממשלה מופעל לחץ גם מצד תנועות לאוטונומיה מקומית בצפון, [א1] שזכו [/א1] בהצלחה מרשימה בבחירות המקומיות במאי השנה. תנועות אלה [א2] דוגלות [/א2] בחלוקתה של איטליה לשלושה אזורים אוטונומיים (צפון, מרכז ודרום) ובהקמתה של מעין קונפדרציה במקום הארגון הממלכתי הנוכחי.",AFTER
42.0.3,42,0,3,"מרכז הפועל אוסר על שחקני הפועל בית שאן להופיע עם סרט שחור (לזכרו של מאיר כהנא) במשחק עם הפועל אום אל-פאחם בליגה א מחוז צפון, שיהיה השבת. מנכ""ל הפועל יעקב אבימור [א1] הבהיר [/א1] אתמול למזכיר מועצת פועלי בית שאן פיני קבלו שאם השחקנים [א2] יממשו [/א2] את איומם לענוד סרט שחור ולעמוד דקת דומיה, הם יועמדו לדין משמעתי בפני ועדת המשמעת העליונה של מרכז הפועל.",BEFORE
2.9.68,2,9,68," אכן, כך עשתה חטיבת ""הראל"". היא [א1] כבשה [/א1] תחילה את המנזר ואת התנגדות האויב שברה לאחר מכן, בקרב מגננה שהתנהל בתוך המנזר (קרב מגננה [א2] מיועד [/א2] לשבירת כוחות חזקים ממך).",VAGUE
35.1.5,35,1,5," דייויד רובינסון קלע אור לאתמול שיא קאריירה, 34 נקודות, והצעיד את סן אנטוניו ספארס לניצחון על דנוור 161351. בחגיגה על הסל של דנוור, [א1] שספגה [/א1] עד כה בממוצע 251 נקודות למשחק, [א2] השתתפו [/א2] גם טרי קאמינגס עם 13 נק ושון אליוט 92 (גם לו שיא קאריירה).",BEFORE
34.25.119,34,25,119," לדעתו, דחייה לא [א1] תשפר [/א1] את המצב. נהפוך הוא: ככל שחולף הזמן [א2] ירבו [/א2] ההתנחלויות היהודיות ויגבר הפונדמנטליזם האיסלמי.",EQUAL
60.2.44,60,2,44," גולן הביע שביעות-רצון מהדרך בה פועלת אלביט, כמפעל פרטי ראשון שקיבל על עצמו, מרצונו, את העקרונות שעל-פיהם עובדת הרשות לשיתוף פעולה תעשייתי. לדבריו [א1] הוקם [/א1] באלביט גוף [א2] שמפקח [/א2] על הקניות ובודק כל הזמנה המיועדת לחו""ל, אם ניתן לרכוש אותה בארץ.",BEFORE
128.7.53,128,7,53," אלכסנדר דיומא הבן, מחבר ""הגברת עם הקמליות"", [א1] ישב [/א1] בקהל, ובלהט הויכוח קרא לעבר אביו, שהיה על הבמה: ""זו היצירה הכי גרועה שלך, פאפא"". האב לא איבד את שלוות רוחו, [א2] שלח [/א2] אצבע ארוכה לעבר בנו, וקרא: ""יש לי רק יצירה אחת גרועה ממנה, וזה אתה"".",BEFORE
22.7.19,22,7,19," מגמה זו [א1] נותרה [/א1] בעינה משך שנים, ולכן גם בראיון אחרון שלו במזרח ירושלים, בעיתון ""א-נהאר"", מובלטת הסיסמה שכהנא למד מגזעני מדינות הדרום בארצות הברית: ""אני אומר את מה שכולם חושבים"". ""א-נהאר"" חזר [א2] והדפיס [/א2] עכשיו, לאחר הרצח, את הראיון המקורי.",BEFORE
98.8.46,98,8,46," ""איני [א1] תומכת [/א1] באף אחד מן הצדדים"", הכריזה. היריב העיקרי שלה, בריאן לניהן מן המפלגה השלטת, נאלץ להתפטר מתפקיד סגן ראש הממשלה יומיים לפני הבחירות, על רקע שערורייה אישית, ותוך איום שמפלגות הקואליציה האחרות [א2] יביעו [/א2] אי-אמון בממשלה אם יישאר בכהונתו.",BEFORE
124.25.94,124,25,94," כעבור זמן מה סיפרה הבת שבגיל תשע [א1] תפרה [/א1] האם את שפתות אבר המין שלה, כיוון שהילדה איחרה לחזור הביתה יום אחד. הילדה [א2] פחדה [/א2] פחד מוות שהאם תחזור על המעשה.",BEFORE
8.0.5,8,0,5,"מזכירות איגוד הפועלים החקלאיים [א1] הציעה [/א1] אתמול שהממשלה תשלם מענק חודשי של 500 ש""ח, נוסף לשכר הרגיל, לכל ישראלי שיעבוד בקטיף ההדרים במשך שלושה חודשים לפחות. מזכיר איגוד הפועלים החקלאיים, חיים אביבי, מסר שההצעה הועלתה לנוכח המחסור בעובדי קטיף [א2] המורגש [/א2] כבר כעת ויוחרף בחודש הבא, כשהקטיף יהיה בעיצומו, בעיקר עקב היעדרות עובדים מהשטחים.",AFTER
70.4.22,70,4,22," כתב העיתון מדווח, מפי פקידים בממשלת ישראל, כי אין כרגע מנגנון של תקשורת ותיאום משותף במישור הצבאי, וכי ""צריך למסד מנגנון כלשהו של תקשורת בין פקידים בכירים משני הצדדים, אשר ישמש במקרה של משבר"". עוד [א1] כותב [/א1] העיתון, על סמך שיחות עם פקידים ישראליים, כי על ארהב להשלים עם העובדה שישראל [א2] תתקוף [/א2] מיגוון גדול של מטרות בשטח עיראק, אם תותקף, וזאת גם אם ארה""ב תספק גיבוי לכך וגם אם לאו.",BEFORE
70.1.7,70,1,7," ממשלת ישראל מקווה ששיחות התיאום האסטרטגי [א1] המתנהלות [/א1] בימים אלה בוואשינגטון בין משלחות ישראל וארה""ב יביאו לפתרון הבעיה של העדר תיכנון ישראלי-אמריקאי משותף, במקרה שיפרוץ עימות צבאי נגד עיראק, שישראל תהייה מעורבת בו. כך [א2] מדווח [/א2] כתב העיתון ""ואשינגטון פוסט"" מפי כתבו בירושלים.",BEFORE
86.2.40,86,2,40," בישיבה השבועית של מזכירות ההסתדרות במרחב חיפה שהתקיימה אתמול נמסר כי בשבועיים האחרונים [א1] חלה [/א1] עלייה בדרישה לפועלים בענף הבנייה, לרבות דרישה לפועלים בלתי מקצועיים, אך נוכח השכר הנמוך המוצע לדורשי העבודה, ההענות היתה מעטה. בישיבה הוחלט שאגודת פועלי הבניין בהסתדרות מרחב חיפה, [א2] תגיש [/א2] בימים הקרובים הצעה לשינוי במבנה השכר של פועלי הבניין במטרה למשוך עובדים לענף זה.",BEFORE
126.3.7,126,3,7, הילדים משתתפים בפעילות היומית של עובדי העיצוב והתכנון [א1] ומבלים [/א1] גם בחדרי הלימוד של אוניברסיטת דיסני. הסמינר [א2] כולל [/א2] מסע לאפקוט ועבודה מעשית בציור או רישום.,AFTER
2.4.48,2,4,48," לכל אלה המתרשמים ומסתפקים בקריאת הכותרת בלבד, אני יכול להבטיח שאכן התנהל שם קרב, והוא היה אחד הקשים והמפוארים בכל קרבות ישראל. ועל כך [א1] תעיד [/א1] ההיסטוריה, ויעידו עשרות הלוחמים שנשארו בחיים [א2] והצליחו [/א2] לבצע את משימתם על אף האבדות הכבדות.",AFTER
54.0.2,54,0,2,"המתח בין שר החוץ דוד לוי ושר הבינוי אריאל שרון גבר באחרונה, לאחר ששרון [א1] סירב [/א1] להאריך את מינויו של צבי סלוצקי, מראשי מחנה לוי, כמנהל מחוז חיפה במשרד הבינוי והשיכון. סלוצקי, שהוא חבר מרכז הליכוד, [א2] מונה [/א2] על ידי לוי כמנהל-בפועל של מחוז חיפה.",AFTER
31.1.41,31,1,41," בשנת 4891 עלתה שם לשלטון מפלגת העבודה וחוללה מהפך בלתי צפוי. במקום להגביר את מעורבות הממשלה במשק, להגדיל את הריכוז ולחזק את הפיקוח על הפעילות הכלכלית, היא הנהיגה ליברליזציה מרחיקת-לכת: הוחלה רפורמה נדיבה במערכת המיסוי, צומצמו או [א1] בוטלו [/א1] ההגנות על התעשייה, נמכרו חברות ממשלתיות, חוסלו מערכות סבסוד [א2] וניתן [/א2] חופש פעולה מונטרי לבנק המרכזי.",EQUAL
96.1.15,96,1,15," מעריכים כי פוטנציאל הביקוש של הקבלנים וחברות הבנייה להשתלבות בעבודות הבנייה להיקפים של כ5405 אלף יחידות-דיור. התאחדות הקבלנים ביקשה מהקבלנים ומחברות הבנייה להצהיר לגבי היקף הבנייה אותה מבקשים הם לבצע בדרך של בנייה יזומה על קרקעות אשר [א1] יוקצו [/א1] להם על-ידי משרד השיכון, או במסגרת של בנייה תקציבית [א2] שתהווה [/א2] אחד מן המסלולים שיופעלו על-ידי המשרד.",EQUAL
50.0.0,50,0,0,"""גליל [א1] נפל [/א1] בידי ירושלים. חניכיו של יורם חרוש [א2] ניצחו [/א2] במשחק המרכזי של המחזור ה-8 את סגן האלוף מהצפון 67 70, לאחר מאבק מורט עצבים, שנסתיים בתקרית מכוערת מאחורי הקלעים.",AFTER
54.49.274,54,49,274," ובינתיים [א1] ממשיך [/א1] ועד העובדים להמטיר על חבריו חוזרים המופנים נגד ההנהלה. בחוזר שהופץ לפני ימים מספר בין כל עובדי הבנק נאמר, בין השאר, כי ב""מפעל סולתם [א2] שיסתה [/א2] ההנהלה כלבים בעובדים, וכאן היא משסה קבוצות עובדים אחת בשנייה.",VAGUE
70.5.27,70,5,27," עוד כותב העיתון, על סמך שיחות עם פקידים ישראליים, כי על ארהב להשלים עם העובדה שישראל תתקוף מיגוון גדול של מטרות בשטח עיראק, אם תותקף, וזאת גם אם ארה""ב [א1] תספק [/א1] גיבוי לכך וגם אם לאו. ""נשמור לנו חופש פעולה במקרה שנותקף"", [א2] אמר [/א2] פקיד ישראלי לכתב העיתון.",AFTER
54.14.69,54,14,69," כן [א1] עומד [/א1] שרון למנות את לימור לבנת, חברת מרכז הליכוד ופעילה במחנה שרון, כיו""ר מרכז הבנייה. שרון [א2] מחפש [/א2] מועמדים שלו להחליף את נסים אבולוף, מקורבו של לוי, בשני תפקידיו יו""ר קרתא ויו""ר החברה לשיקום הרובע היהודי בירושלים.",EQUAL
117.25.166,117,25,166, בימים אלה [א1] חויבו [/א1] החוסכים בניירות-ערך בעמלת דמי-ניהול לרבעון. בחלק מהבנקים [א2] קיים [/א2] הסדר של התרעה מראש על-ידי חיוב בערך עתידי.,AFTER
122.11.89,122,11,89," תמיד סיקרן אותי לדעת מי המציא את השמות המוזרים הללו לתוכניות החיסכון, [א1] שהתהדרו [/א1] עתה בשם המוזר ""כוח תשורת המשך"". למדתי שזכות היוצרים מחולקת בין האוצר לבין הבנקים: האוצר, באשרו מסגרת כללית לסוג תוכניות מסוים, המציא את השם ""תשורה"" (קודם לכן ""תשואה""), ועתה התיר להוסיף את התיבה ""המשך"" לתוכנית מתוקנת; בנק לאומי המציא את ""כוח"", בנק הפועלים [א2] הבריק [/א2] ב""מטמון"" וכולי.",AFTER
31.25.197,31,25,197," התוצאה הבלתי נמנעת תהיה, שמוסדות הרפואה [א1] ייזהרו [/א1] ויישמרו מקליטת רופאים חדשים מקרב העולים. הקשיחויות בתחום השכר ובלשון גלויה יותר, האיגודים המקצועיים [א2] הלוחמים [/א2] בתקיפות למען האינטרסים של העובדים-המועסקים הם האיום החמור ביותר על סיכויי המימוש של משימות המשק בשנים הקרובות.",AFTER
33.12.32,33,12,32," ומי לא [א1] ייזכר [/א1] לשמע הדברים באדולף המנוח. ואולם, רגע הפגיון בגב [א2] יגיע [/א2] באופן בלתי נמנע.",BEFORE
54.27.148,54,27,148," ח""כים אחדים טענו בהנהלת הסיעה כי ריבלין [א1] פסול [/א1] כחבר בוועדת חוץ וביטחון מפני שלא השתתף השבוע בהצבעה במליאת הכנסת על הסרת חסינותו של ח""כ מוחמד מיעארי. ח""כ צחי הנגבי טען כי ריבלין אינו ראוי לפרס על התנהגותו המחפירה, שבה [א2] הכשיר [/א2] את אש""ף בכנסת.",AFTER
77.4.9,77,4,9," בשלב זה אין בדעת הקיבוץ הארצי להקים מלון במקום, אלא להתבסס על תשתית קיימת של מלונות באשקלון ו""צימרים"" בקיבוצים הסמוכים נגבה ורבדים. אורחן לנהגים ליד קיבוץ בית גוברין, [א1] המשלב [/א1] תחנת דלק עם מסעדה, מרכז מכירות ומידע לנהגים, [א2] ייפתח [/א2] בינואר הקרוב, בהשקעה של 1.",BEFORE
98.0.9,98,0,9,"לונדון (מיוחד ל""הארץ""). מרי רובינסון, פרקליטה בת 64, שנבחרה לנשיאת אירלנד ביום חמישי בלילה, קבעה תקדימים בתחומים רבים: היא האישיות הראשונה שנבחרה לכהונה זו שאינה [א1] נמנית [/א1] עם המפלגה השלטת, היא האשה הראשונה בתפקיד, והיא הנשיא הצעיר ביותר [א2] שנבחר [/א2] אי-פעם ברפובליקה האירית.",BEFORE
128.27.140,128,27,140," אחרי שיחה נזעמת בארבע עיניים [א1] הגיעו [/א1] דיומא והמו""ל להסכם שכר חדש. טיב ההסכם לא נודע, אך הגיבור [א2] המגמגם [/א2] מת מיתה משונה עוד באותו פרק.",AFTER
31.6.124,31,6,124," מדוע נכשלה המדיניות, ובעיקר בתחום התעסוקה? השבועון ""אקונומיסט"" [א1] משוכנע [/א1] כי ההסבר העיקרי הוא שממשלת ניו זילנד היתה נועזת, אך לא נועזת דיה: היא נמנעה מלטפל בהיבט חיוני שבלעדיו לא תצליח שום רפורמה, דהיינו מערכת העבודה, השכר והאיגוד המקצועי. בתחום זה לא נעשה דבר: הסכמי העבודה [א2] נשארו [/א2] קשוחים כשהיו, השכר נקבע בשיטות ריכוזיות על בסיס הצמדות וללא כל זיקה למצב בשוק העבודה, והאיגודים המקצועיים המשיכו להפעיל זכויות בלעדיות במשא ומתן עם המעסיקים על מקומות העבודה ותנאיה, תוך התעלמות ממצב המשק.",AFTER
79.9.32,79,9,32," מנכ""ל משרד התיירות הדגיש בדבריו לפני הנוכחים, כי בעוד הטמפרטורה בבודפשט היא אפס מעלות, מראה הטמפרטורה באילת 82 מעלות צלסיוס. לדברי רוזנטל, [א1] הושלמו [/א1] בהצלחה המגעים עם סיטונאי התיירות של בריטניה, [א2] שהתחייבו [/א2] להמשיך ולפרסם את ישראל בתוכניות קיץ 19.",VAGUE
8.1.42,8,1,42," מזכיר איגוד הפועלים החקלאיים, חיים אביבי, מסר שההצעה הועלתה לנוכח המחסור בעובדי קטיף המורגש כבר כעת ויוחרף בחודש הבא, כשהקטיף יהיה בעיצומו, בעיקר עקב היעדרות עובדים מהשטחים. המעסיקים אינם מצפים [א1] שיצליחו [/א1] למשוך מספר ניכר של עובדים ישראליים לקטיף, בגלל השכר הנמוך [א2] המשולם [/א2] לעבודה זו מעט מעל שכר המינימום במשק.",AFTER
34.0.0,34,0,0,לפני כמה שבועות [א1] הזמינה [/א1] להקת חובבים של המושבה האמריקאית הקטנה בריאד קבוצת חיילים של צבא ארצות הברית להופעה [א2] שנערכה [/א2] לכבודם בבניין השגרירות. אחרי משא ומתן ממושך נענו שלטונות הצבא לבקשתן של רשתות הטלוויזיה האמריקאיות לצלם את האירוע הצבעוני.,BEFORE
131.6.12,131,6,12," בכל פעם ששרון טוען שצריך סדר חדש, אני [א1] מעמידה [/א1] כנגד טענתו שש מאות סימני שאלה. ירושלים לכולם היתה רוצה ממשלתנו לספק פתרונות דיור הולמים: למיליון עולים חדשים, לזוגות צעירים, ליוצאי צה""ל, לחסרי דיור ועוד זאת גם [א2] כשמדובר [/א2] בגיוס משאבים עצומים בארץ ובחו""ל.",VAGUE
128.15.117,128,15,117," הוא רוכש לעצמו בגדים נאים [א1] ונהנה [/א1] מחברתן של נשים יפות, למעלה ממעמדו. דיומא [א2] מוביל [/א2] את גיבורו במשעול הצר שבין ""פאוסט"", מצד אחד, ו""דוקטור גקיל ומיסטר הייד"", מצד שני.",AFTER
8.0.8,8,0,8,"מזכירות איגוד הפועלים החקלאיים הציעה אתמול שהממשלה [א1] תשלם [/א1] מענק חודשי של 500 ש""ח, נוסף לשכר הרגיל, לכל ישראלי [א2] שיעבוד [/א2] בקטיף ההדרים במשך שלושה חודשים לפחות. מזכיר איגוד הפועלים החקלאיים, חיים אביבי, מסר שההצעה הועלתה לנוכח המחסור בעובדי קטיף המורגש כבר כעת ויוחרף בחודש הבא, כשהקטיף יהיה בעיצומו, בעיקר עקב היעדרות עובדים מהשטחים.",AFTER
133.10.15,133,10,15," בקלאבריה [א1] נרצח [/א1] בממוצע איש אחד בכל יום, והממוצע לדרום כולו גבוה פי כמה. הפשע המאורגן אינו [א2] נתון [/א2] בידי קבוצה אחת.",EQUAL
34.15.49,34,15,49," אבל אפשר שהאמריקאים לומדים בימים אלה פרק חשוב בהבנת המזרח התיכון. התנהגותם מזכירה פוליטיקאים ישראלים (ביניהם כאלה [א1] הלועגים [/א1] היום לחיזור האמריקאי אחרי הקואליציה הערבית) [א2] זוללי [/א2] שרימפס, החובשים כיפה על ראשם ומשחרים לפתחם של רבנים אנטי-ציונים.",AFTER
60.2.37,60,2,37," גולן הביע שביעות-רצון מהדרך בה פועלת אלביט, כמפעל פרטי ראשון [א1] שקיבל [/א1] על עצמו, מרצונו, את העקרונות שעל-פיהם עובדת הרשות לשיתוף פעולה תעשייתי. לדבריו הוקם באלביט גוף שמפקח על הקניות ובודק כל הזמנה [א2] המיועדת [/א2] לחו""ל, אם ניתן לרכוש אותה בארץ.",VAGUE
120.4.13,120,4,13," ""הבחירה [א1] מנסה [/א1] לתת מגוון מייצג של האמנות הישראלית בתקופה בה יצא האלבום"", אומרת ציפורה אנגלמן, ממנהלות הפרויקט. האלבומים אינם [א2] כרוכים [/א2] כספר, אלא אסופת הדפסים בפורמט מלא.",BEFORE
54.22.117,54,22,117," אולם שר התעשיה והמסחר משה נסים, שהיה שותף בצוות המו""ם עם אגו""י והמפלגות הדתיות, אינו מעוניין בסגן שר במשרדו, וגם ארנס אינו מתלהב יותר מדי להצעה כזו. עד שיזכה ביבי במשרה [א1] שתיראה [/א1] לו הודיעה המפד""ל לשמיר כי נציגה בוועדת הכספים, ח""כ ביבי, לא יתמוך במתן משרת יו""ר הועדה לאגו""י וללא קולו [א2] יתקשה [/א2] הליכוד בהשגת רוב בוועדה להחלפת היו""ר.",AFTER
54.23.122,54,23,122," עד שיזכה ביבי במשרה [א1] שתיראה [/א1] לו הודיעה המפד""ל לשמיר כי נציגה בוועדת הכספים, ח""כ ביבי, לא יתמוך במתן משרת יו""ר הועדה לאגו""י וללא קולו יתקשה הליכוד בהשגת רוב בוועדה להחלפת היו""ר. נוכח המצב, [א2] הציעו [/א2] אתמול בכירים בליכוד להצמיד את סגן השר ביבי אל עמיתו אפרים גור, כך שאם לשניהם אין הרבה סמכויות, אולי יוכלו להסתובב יחד ולחסוך איזה ""וולבו"" ולשכה.",AFTER
138.1.20,138,1,20," במפלגה השמרנית מסתמנת קבוצה חזקה המתכוונת להעמיד את מייקל הסלטיין כמועמד נגד מארגרט תאצר, בהתמודדות הקרובה על המנהיגות, שנקבעה ל02 בנובמבר. גורמים המקורבים לתאצר אמרו שהיא [א1] רואה [/א1] בשר החוץ, דאגלס הרד, את יורשה במקרה של ""תקרית אוטובוס"", מונח [א2] שמשתמשים [/א2] בו כדי לציין למי למסור את השלטון אם המנהיג יידרס.",AFTER
